{
  "agent_id": "evidence-extraction",
  "run_id": "example-run-003",
  "generated_at": "2026-07-07T12:00:00Z",
  "status": "needs_human_review",
  "requires_human_review": true,
  "source_policy_compliant": true,
  "drug_id": "exampledrug",
  "uncertainty_flags": [
    "FICTIONAL EXAMPLE — NOT REAL CLINICAL DATA",
    "No live extraction performed; example output only."
  ],
  "prohibited_actions_avoided": true,
  "outputs": [
    {
      "output_type": "evidence_packet_draft",
      "summary": "FICTIONAL EXAMPLE — proposed terminology mapping packet draft for human review.",
      "citation_ids": [],
      "clinical_recommendation": false,
      "confidence": "needs_human_review",
      "payload": {
        "proposed_packet": {
          "packet_type": "terminology_mapping",
          "claim_summary": "FICTIONAL EXAMPLE — identity metadata placeholder pending reviewer assignment of citation IDs.",
          "clinical_claim": null,
          "citation_ids": [],
          "source_ids": [
            "exampledrug-src-0100"
          ],
          "requires_human_review": true,
          "review_level": "level_0_admin",
          "recommendation_impact": "none",
          "uncertainty_flags": [
            "not_yet_reviewed"
          ]
        },
        "proposed_citations": []
      }
    }
  ],
  "notes": "Scaffold example aligned with evidence schema v1.0. Not clinical content."
}
